[{"artifact_sha256":"c2384202e233a9dcb311ddd4ea7650a358d7bc444965f04b32e1517c4fd0f0d6","ingest_version":"text-v1","offset_unit":"unicode_code_point_half_open","pages":[{"page_number":1,"printed_label":null,"text":"At the fictional Meridian Institute, Professor Bora Example supervised Aylin Demo's doctoral work. Aylin Demo and Bora Example later co-authored the imaginary paper \"Gardens of Symmetry\". Aylin Demo and Cem Sample appeared together at the fictional Solstice Mathematics Workshop.\n","text_sha256":"87abdce55610c805edcbb0f169c54de090c66ac7690652163b221d013a88eadd"}],"source_id":"source:synthetic_meridian_note","source_sha256":"87abdce55610c805edcbb0f169c54de090c66ac7690652163b221d013a88eadd"}]
